[
  {
    "id": "claude-opus-5",
    "name": "Claude Opus 5",
    "company": "Anthropic",
    "type": "闭源",
    "logo": "/logos/anthropic.svg",
    "scores": {
      "intelligence": 63.0532452071291,
      "coding": 89.1,
      "agentic": 59.1729518900344
    },
    "speed": {
      "median_tps": 58.8310732458971,
      "ttft_seconds": 60.1170464360001,
      "e2e_seconds": 68.61595649174807,
      "p05_tps": null,
      "p95_tps": null
    },
    "benchmarks": {
      "gpqa": 0.932323232323232,
      "hle": 0.548656163113994,
      "scicode": 0.556712962962963,
      "lcr": 0.756666666666667,
      "critpt": 0.291428571428571,
      "ifbench": null,
      "tau2": null,
      "terminalbench_hard": null,
      "mmmu_pro": 0.847398843930636,
      "gdpval": 1844.67,
      "livecodebench": null,
      "aime25": null
    },
    "pricing": {
      "input": 5,
      "output": 25,
      "blended": 10.0,
      "display": "$5/$25 (USD/百万token)"
    },
    "flags": {
      "frontier": true,
      "open_weights": false,
      "reasoning": true,
      "image_input": true,
      "chinese_eval": false,
      "has_speed": true,
      "has_pricing": true,
      "data_complete": true,
      "tools_calling": true
    },
    "meta": {
      "context_window": 1000000,
      "size_class": "large",
      "parameters": null,
      "release_date": "2026-07-24",
      "knowledge_cutoff": null,
      "omniscience": 37.0666666666667,
      "modalities": {
        "input": [
          "text",
          "image",
          "file"
        ],
        "output": [
          "text"
        ]
      },
      "max_output_tokens": 128000
    },
    "url": "https://artificialanalysis.ai/models/claude-opus-5",
    "vendor_links": {
      "homepage": "https://www.anthropic.com",
      "console": "https://console.anthropic.com"
    },
    "license": null,
    "openrouter_weekly_tokens": 2579325889312,
    "openrouter_pricing": {
      "prompt": 5.0,
      "completion": 25.0
    },
    "arena_rankings": {
      "text": {
        "rank": 5,
        "score": 1497.0,
        "votes": 76389
      },
      "code": {
        "rank": 14,
        "score": 1558.0,
        "votes": 14353
      },
      "vision": {
        "rank": 5,
        "score": 1299.0,
        "votes": 20857
      }
    },
    "arena_votes": 25628,
    "data_completeness_pct": 85.0
  },
  {
    "id": "claude-fable-5",
    "name": "Claude Fable 5",
    "company": "Anthropic",
    "type": "闭源",
    "logo": "/logos/anthropic.svg",
    "scores": {
      "intelligence": 62.0726622017462,
      "coding": 84.6,
      "agentic": 56.5947766323024
    },
    "speed": {
      "median_tps": 75.2181688600041,
      "ttft_seconds": 128.308487586,
      "e2e_seconds": 134.95581771352013,
      "p05_tps": null,
      "p95_tps": null
    },
    "benchmarks": {
      "gpqa": 0.926262626262626,
      "hle": 0.554680259499537,
      "scicode": 0.601851851851852,
      "lcr": 0.766666666666667,
      "critpt": 0.2857142857,
      "ifbench": 0.63469387755102,
      "tau2": 0.985380116959064,
      "terminalbench_hard": 0.628787878787879,
      "mmmu_pro": null,
      "gdpval": 1737.71,
      "livecodebench": null,
      "aime25": null
    },
    "pricing": {
      "input": 10,
      "output": 50,
      "blended": 20.0,
      "display": "$10/$50 (USD/百万token)"
    },
    "flags": {
      "frontier": true,
      "open_weights": false,
      "reasoning": true,
      "image_input": true,
      "chinese_eval": false,
      "has_speed": true,
      "has_pricing": true,
      "data_complete": true,
      "tools_calling": true
    },
    "meta": {
      "context_window": 1000000,
      "size_class": "large",
      "parameters": null,
      "release_date": "2026-06-09",
      "knowledge_cutoff": null,
      "omniscience": 43.3,
      "modalities": {
        "input": [
          "text",
          "image",
          "file"
        ],
        "output": [
          "text"
        ]
      },
      "max_output_tokens": 128000
    },
    "url": "https://artificialanalysis.ai/models/claude-fable-5",
    "vendor_links": {
      "homepage": "https://www.anthropic.com",
      "console": "https://console.anthropic.com"
    },
    "license": null,
    "openrouter_weekly_tokens": 279928937932,
    "openrouter_pricing": {
      "prompt": 10.0,
      "completion": 50.0
    },
    "arena_rankings": {
      "text": {
        "rank": 1,
        "score": 1507.0,
        "votes": 23626
      },
      "code": {
        "rank": 6,
        "score": 1626.0,
        "votes": 8219
      },
      "vision": {
        "rank": 1,
        "score": 1315.0,
        "votes": 8333
      }
    },
    "arena_votes": 23626,
    "data_completeness_pct": 85.0
  },
  {
    "id": "gpt-5-6-sol",
    "name": "GPT-5.6 Sol",
    "company": "OpenAI",
    "type": "闭源",
    "logo": "/logos/openai.svg",
    "scores": {
      "intelligence": 60.9298701329203,
      "coding": 88.0,
      "agentic": 57.7836323024055
    },
    "speed": {
      "median_tps": 70.8836574200359,
      "ttft_seconds": 209.1068315325,
      "e2e_seconds": 216.1606436268329,
      "p05_tps": null,
      "p95_tps": null
    },
    "benchmarks": {
      "gpqa": 0.941414141414141,
      "hle": 0.494902687673772,
      "scicode": 0.561342592592593,
      "lcr": 0.776666666666667,
      "critpt": 0.322857142857143,
      "ifbench": 0.726530612244898,
      "tau2": 0.850877192982456,
      "terminalbench_hard": 0.659090909090909,
      "mmmu_pro": 0.834104046242775,
      "gdpval": 1722.96,
      "livecodebench": null,
      "aime25": null
    },
    "pricing": {
      "input": 5,
      "output": 30,
      "blended": 11.25,
      "display": "$5/$30 (USD/百万token)"
    },
    "flags": {
      "frontier": true,
      "open_weights": false,
      "reasoning": true,
      "image_input": true,
      "chinese_eval": false,
      "has_speed": true,
      "has_pricing": true,
      "data_complete": true,
      "tools_calling": true
    },
    "meta": {
      "context_window": 1000000,
      "size_class": "large",
      "parameters": null,
      "release_date": "2026-07-09",
      "knowledge_cutoff": null,
      "omniscience": 21.9666666666667,
      "modalities": {
        "input": [
          "file",
          "image",
          "text"
        ],
        "output": [
          "text"
        ]
      },
      "max_output_tokens": 128000
    },
    "url": "https://artificialanalysis.ai/models/gpt-5-6-sol",
    "vendor_links": {
      "homepage": "https://openai.com",
      "console": "https://platform.openai.com"
    },
    "license": null,
    "openrouter_weekly_tokens": 939940707994,
    "openrouter_pricing": {
      "prompt": 2.5,
      "completion": 15.0
    },
    "arena_rankings": {},
    "arena_votes": 18535,
    "data_completeness_pct": 77.4
  },
  {
    "id": "grok-4-6",
    "name": "Grok 4.6",
    "company": "SpaceXAI",
    "type": "闭源",
    "logo": "/logos/spacexai.svg",
    "scores": {
      "intelligence": 60.92297113115,
      "coding": 88.4,
      "agentic": 58.6762164948454
    },
    "speed": {
      "median_tps": 66.0765189387406,
      "ttft_seconds": 43.7421927705001,
      "e2e_seconds": 51.309177351869295,
      "p05_tps": null,
      "p95_tps": null
    },
    "benchmarks": {
      "gpqa": 0.94949494949495,
      "hle": 0.429101019462465,
      "scicode": 0.53587962962963,
      "lcr": 0.75,
      "critpt": 0.171428571428571,
      "ifbench": null,
      "tau2": null,
      "terminalbench_hard": null,
      "mmmu_pro": null,
      "gdpval": 1747.45,
      "livecodebench": null,
      "aime25": null
    },
    "pricing": {
      "input": 2,
      "output": 6,
      "blended": 3.0,
      "display": "$2/$6 (USD/百万token)"
    },
    "flags": {
      "frontier": true,
      "open_weights": false,
      "reasoning": true,
      "image_input": true,
      "chinese_eval": false,
      "has_speed": true,
      "has_pricing": true,
      "data_complete": true,
      "tools_calling": true
    },
    "meta": {
      "context_window": 500000,
      "size_class": "large",
      "parameters": null,
      "release_date": "2026-08-12",
      "knowledge_cutoff": null,
      "omniscience": 30.4833333333333,
      "modalities": {
        "input": [
          "text",
          "image",
          "file"
        ],
        "output": [
          "text"
        ]
      },
      "max_output_tokens": null
    },
    "url": "https://artificialanalysis.ai/models/grok-4-6",
    "vendor_links": {
      "homepage": "https://x.ai",
      "console": "https://console.x.ai"
    },
    "license": null,
    "openrouter_weekly_tokens": 495444033832,
    "openrouter_pricing": {
      "prompt": 2.0,
      "completion": 6.0
    },
    "arena_rankings": {},
    "arena_votes": 1519,
    "data_completeness_pct": 77.4
  },
  {
    "id": "kimi-k3",
    "name": "Kimi K3",
    "company": "Kimi",
    "type": "开源",
    "logo": "/logos/kimi.svg",
    "scores": {
      "intelligence": 59.6994671342592,
      "coding": 85.0,
      "agentic": 54.2624604810997
    },
    "speed": {
      "median_tps": 39.3420429397922,
      "ttft_seconds": 53.62301435344945,
      "e2e_seconds": 66.3320645866868,
      "p05_tps": null,
      "p95_tps": null
    },
    "benchmarks": {
      "gpqa": 0.935353535353535,
      "hle": 0.468952734012975,
      "scicode": 0.586805555555556,
      "lcr": 0.826666666666667,
      "critpt": 0.234285714285714,
      "ifbench": null,
      "tau2": null,
      "terminalbench_hard": null,
      "mmmu_pro": 0.805202312138728,
      "gdpval": 1681.09,
      "livecodebench": null,
      "aime25": null
    },
    "pricing": {
      "input": 3,
      "output": 15,
      "blended": 6.0,
      "display": "¥20.0/¥100.0"
    },
    "flags": {
      "frontier": true,
      "open_weights": true,
      "reasoning": true,
      "image_input": true,
      "chinese_eval": true,
      "has_speed": true,
      "has_pricing": true,
      "data_complete": true,
      "tools_calling": true
    },
    "meta": {
      "context_window": 1048576,